review_id,course_name,location,architect,year_built,review_title,review_author,file_name,review_text
40,Crystal Downs,"Frankfort, MI",Alister MacKenzie/Perry Maxwell,1932,"Crystal Downs Country Club (Frankfort, Michigan)",Bill Satterfield,rev40_crystal_downs_2,"Dr. MacKenzie's work at Crystal Downs is nothing short of masterful as he created one of the holy grails for students of golf course architecture to study. The challenge on and around the greens creates the most demanding 6500 yards I've ever encountered, especially since the driving corridors are relatively generous. Nearby Arcadia Bluffs has more ""wow factor"" due to dramatic features and stunning Lake Michigan views, but Crystal Downs is a more elegant brilliance on a beautiful piece of property. If given the opportunity to play Crystal Downs, drop every possible conflict you have and soak in the privilege of playing one of golf's best creations.  Grade A+

Quick Facts
Designer:  Alister Mackenzie in 1931

Cost:  Private

Phone Number:  (231) 352-9933

Directions:  Get here! - 249 Crystal Downs Dr, Frankfort, Michigan  49635 – UNITED STATES

What to Expect:  Special. That is the first word that comes to mind when I reflect on Crystal Downs. Everything about Crystal Downs is special to the golfer that has developed a palate for the subtleties found in masterful architecture; architecture that challenges the mind as much as the body. Players are taken on a roller coaster of emotions as they traverse in and out of holes that range from being relatively easy to diabolically difficult to flat out brilliant. I've never played a course that I wanted to replay immediately afterwards as much as Crystal Downs. The subtleties in the design just beg you to come back and challenge again to see if you can play better the second time around. The course is short enough that you think you should be able to take advantage of it, but in the same vein as Merion, Crystal Downs demands respect and wisdom in every shot to avoid being punished more harshly than you would imagine. The speed and slope of the greens command absolute precision and will quickly expose any shortcomings you have with your putter or wedges; more so than any other course I've seen. From the pro shop and first tee you have a view of the entire front nine coupled with views of Crystal Lake; it is truly one of the most impressive panoramas in all of golf. On the back nine you are afforded glimpses of Lake Michigan and I was surprised there weren't more views of it, but the course is so good on its own that the backdrops suddenly don't matter that much. Holes 5-9 can only be rivaled by Pebble Beach as one of my all time favorite front nine stretches in golf, #13 is one of the finest and most demanding two-shotters I've had the privilege of playing, and #17 launched itself to the top of my favorite driveable par 4s. The first time around the course there might be a couple of holes that don't wow you or perhaps are drowned out due to how phenomenal other holes on the property are, but I think you'll find greater appreciation for those understated holes in subsequent loops around Crystal Downs. The course is a challenging walk given how hilly the terrain is and caddies are available through the main season though many players will elect to ride a cart. Crystal Downs may rivals Cypress Point as having the most understated pro shop and general amenities in contrast to how incredible the golf is; something I really love because it shows how the club is simply all about golf. It has nothing to do with the course itself, but it should be noted that the staff and membership are perhaps the most down to earth people I've come across at a Top 20 course and appreciate visitors who know and understand golf course architecture and the brilliance that is Crystal Downs.

By the Numbers

Tees	Par	Yardage	Rating	Slope
Blue	70	6518	72.3	138
White	70	6302	71.3	135
Gold	70	5594	68.9	128
Red (Women)	70	5466	72.7	134

Individual Hole Analysis
Signature Hole:  17th Hole – 311 Yard Par 4 – Crystal Downs lays claim to a handful of the finest golf holes on the planet and this is certainly one of them. The 17th at Crystal Downs is the most treacherous driveable par four you are likely to ever face. When the wind is in your face tunnelled through the trees the green becomes unreachable and players have to figure out a safe place to hit their tee ball. The fairway tilts severely from right to left and features limited good options. A tee shot that doesn't carry 180 yards will require hacking out of the junk into the fairway and effectively eliminating any birdie chance. A 200 yard tee shot will feed into a popular bowl to hit from although the angle leaves a limited view of the green. Tee shots that go deep up the left side are dead while a 250 - 280 drive towards the right greenside bunker will leave the ideal spot to hit from. 311 yards may look like a pushover on the scorecard but I have no doubt that this hole plays over par every single day of the year.

17th Hole at Crystal Downs Country Club (311 Yard Par 4)
Best Par 3:  9th Hole – 175 Yards – Another brilliantly difficult hole that just doesn't seem that intimidating from the tee. While the uphill nature of the tee shot may get into some golfer's heads, it is everything around the green that should be kicking the fear in. The safe play is short right, but not so short that your ball feeds right back down the fairway. Carrying it to long on the right side and finding the bunker will result in one of the most difficult sand saves of your life given how nasty the green is at feeding balls away from the hole and back to the front edge of the green or off altogether. Anything left of the green is an instant double bogey . . . at best.

9th Hole at Crystal Downs Country Club (175 Yard Par 3)
Best Par 4:  5th Hole – 353 Yards – Perhaps Crystal Downs' most acclaimed hole, the 5th is a wonderful example of not needing a ton of length to have a strategic hole with sufficient difficulty. The brilliance in any design incorporates viable options throughout rather than demanding specific shots all day long. On the 5th hole multiple options are presented off the tee since a trio of bunkers part the hogback fairway. The safest tee shot is left of the bunker but sets up a blind approach shot to a green that slopes away from the player. Hitting right of the bunkers sets up a much better angle to the green but brings a large tree into play and long ballers may have their tee shot scoot into trouble since a view of the right side of the hogback fairway is not offered. Some players may elect to stay short of the bunker trio while other may want to test their merits at carrying the spacious bunker in the waste area with a power fade that can feed the ball up near the green. The theme of difficult greens is back in full force on the 5th hole which features a severely sloped back-to-front and left-to-right surface that often feeds balls to the grass edge between the green and bunkers. Holes like this make Crystal Downs and Merion the most well designed and difficult ""short"" courses in the country.

5th Hole at Crystal Downs Country Club (353 Yard Par 4)
Best Par 5:  8th Hole – 550 Yards – Another great hole and one of the most revered par fives in world. In a day and age where architects often feel they need to laden a hole with an undue amount of bunkering or hazards, Dr. MacKenzie lets Mother Earth be the star here by draping this three-shotter over a very undulated fairway that climbs uphill the whole way home. 550 yards may seem reachable for some players, but the significant uphill climb eliminates that thought for most players as they just try to figure out a good spot to hit their third shot from to attack the green. There are so many undulations throughout the wide fairway that it is useless to focus on any one particular location as a lay up zone, but I will recommend that you lay up closer to the green than your traditional ""favorite yardage"" since the uphill nature of the approach shot will add a full club to reach the small green. Perfect golf is required to birdie this hole; near perfect golf is needed for a par.

8th Hole at Crystal Downs Country Club (550 Yard Par 5)
Birdie Time:  7th Hole – 335 Yard Par 4 – How could anyone ever tire of playing Crystal Downs? It is a living masterpiece and the 7th hole features on of the most unforgettable greens you'll ever play. The tee shot plays to a fairway that runs out of room about 225 yards from the tee. Most players will play short of that drop off and allow themselves a clean view of the boomerang green that lies in wait. Bolder players may elect to hit their tee shot into the swell beyond the end of the fairway and leave themselves with a shorter, but blind approach to the green. The boomerang shaped green wraps around a hill which also features a pair of sloping bunkers. If you can't have fun putting on this green to the various pin locations then you need to pick up backgammon or something because this green is a blast!

7th Hole at Crystal Downs Country Club (335 Yard Par 4)
Bogey Beware:  13th Hole – 442 Yard Par 4 – Writing this review reminds me of just how good Crystal Downs is. Each time I get to a hole to write commentary on I think, ""Oh yeah, that really was an awesome hole!"" The 13th is one of my all time favorite par fours which is saying alot considering my favorite two-shotters are generally oceanside like Pebble Beach's 8th, Cypress Point's 17th, and Maidstone's 9th.. This dogleg right calls for a fade off the tee that falls on the right half of the fairway while avoiding the forest and bunker right of the rough. A shot that comes to rest short of the right fairway bunker will be greeted by a looming tree that will block, or at a minimum alter, your approach shot into the green. Approaching this green from the left is instant death as the vast majority of balls will end up tumbling into the right greenside bunker. To say that the front-to-back and left-to-right tilt of the green is severe would be an understatement considering some might even contend it isn't fair, but that is some of the beauty of this hole. The middle of the green is divided by a ridge that causes more havoc in a green than any other I can recall. If your ball is resting on the opposite side of the ridge from the hole your chances of two-putting are quite low considering how difficult it is to even keep the ball on the green while crossing the ridge. To tame this beast with a four or better may be the most rewarding experience on the course considering it is easily the toughest par on the course. If someone told me there were more snowman scores on this hole than pars I would believe it."
41,Seminole,"Juno Beach, FL",Donald Ross,1929,Seminole Golf Club,Cal Simmons,rev41_seminole_1,"For someone that gets to Florida once a decade, playing all the great courses in the state is difficult. Particularly so when the courses are in remote areas of this large state. Seminole is on the ocean in the far southeast part. I had come to peace with the fact that I would never play what many call Donald Ross’s finest work, Seminole. Then the invitation from a friend came in. 

“We will meet Tuesday at 12:30 for lunch, play 18 in the afternoon, 36 on Wednesday and 18 on Thursday,” he said. A dream trip. It seems that after playing a great course you want another crack at it. I would have four chances to figure out how to play this gem.

I make my way down the long narrow road that also serves as access for an adjacent residential area. Ten foot high oleanders keep the course hidden from the outside world. I creep around the corner into the gravel parking lot. 

There is nothing ostentatious about Seminole. Gravel parking lot, modest clubhouse, no attendants swarming those arriving. I change shoes in the parking lot, give my clubs to the only outside services person and head to the patio for lunch. 

Once a club not welcoming to the outside world, the attitude has changed. With the televised skins game featuring PGA Tour players during the pandemic, and hosting the Walker Cup Match on May 8th and 9th, 2021, the world finally will see this fabulous course.

After a brief warm up I stand on the first tee. I am struck by how flat the course is. There are a few palm trees and no punitive rough. Sandy waste areas appear to outline many of the fairways. Bunkers define the flow of the holes. 

The course is minimalist to an extreme. Other than tee markers, flagsticks and rakes there is nothing else on the course. There are no benches, ball washers, directional markers, above ground waste cans, rest rooms. There is one spot for water on each nine, well out of play and partially hidden in the bushes. It’s a clean look that is refreshing. 

The only refreshment stand is after hole nine, located on the lower level of the clubhouse.

While the first hole appears benign, we learn quickly that this course is going to be about iron shots into the greens, being on the correct side of the hole and judging distance control. 

“By the time we finish four rounds you will appreciate the precision required on each hole,” my host says to me. How prophetic that was.

Rumor has it that during a regrassing project over 50 years ago many of the humps, bumps and rolls disappeared. However, what remains are 18 of the most demanding green complexes I have seen. A ball hit to the wrong side of the hole location can trickle off into a bunker or 50 yards down a slope into a waste area. 

Often a drive to the wrong side of the fairway will leave a shot requiring such distance control and accuracy that even the finest players are challenged. 

Local knowledge is important. Knowing where the deep section of the green is or where not to have the ball land can mean the difference between par and double bogey. The superior caddies take care of the knowledge component. 

The sand based greens are firm and fast, maybe the fastest I have ever played. 

A forty foot high sand dune runs along the far side of the course. Another is along the ocean side. Ross uses the dunes brilliantly. What appears from the first tee to be a flat course with little interesting topography is anything but. 

Thirteen holes use the dunes. While the sandy waste areas in the flat are firm sand, off the fairway the dunes sand is sink your feet in soft. This leaves a wayward shot into the dunes sand all but unplayable, plugged after missing the fairway. 

The holes that do not use the dunes have challenging green complexes with false fronts, tight bunkering and greens sloping in all directions. 

Water flows in and out of ponds in the middle of the property. With firm fairways and little rough a ball heading toward the water will not stop, no matter how much pleading the player exerts. 

Holes run in every direction. No back and forth here. This generates interesting challenges because the wind blows nearly constantly and from day to day in every direction.

Famously, Ben Hogan would spend time at Seminole preparing for the Masters. Just like Augusta National, Seminole demands strategic positioning off the tee with accurate iron shots to the greens. 

Rumor has it that his favorite hole was the sixth, an uphill par four to a well bunkered green running diagonally away from the player. The green is somewhat remindful of the 12th at Augusta, with the carry required to the right portion of the green longer than the left. 

Tipping out at 7320, the challenge for all players is to hit the ball high enough to hold the firm, fast, elevated greens, while controlling the distance to the correct position on the green. 

Modern architecture features wide fairways. Players want to find their ball. However, the great courses have always had wide fairways. Augusta National, Pine Valley, Sand Hills, to name a few. The fairways are generous at Seminole. 

Starting at the second hole the course moves up and around the major sand dune on the course. The holes are challenging, bunkers deep and the greens severe. The teeth of the course are the holes on and around the dunes. 

Ross gives the player a breather on the flat holes 8-10, until going back up the dune at numbers 11 thru 14. The course finishes with the challenging 16th green, terrific short down hill par three 17th and fun shortish par 4, 18th. 

Not that the breather holes are easy. An errant shot to a green can quickly turn into a double bogey or worse. 

One of the most difficult holes to build is a great uphill par three. Having a green with character visible from the tee, along with creative bunkering, is rarely seen. 

The 13th is just such a par 3. Another green that diagonally moves away from the player, two large bunkers ominously await the errant shot that hangs to the right. 

Not to be missed at Seminole is the locker room. It’s as large an open locker room as I have ever seen. Jack Burke and Jimmy Demerit patterned some aspects of the locker room at Champions Golf Club in Houston after Seminole, as have other clubs. 

With ceilings 25’ high or higher, the winners of the club tournaments are painted on the large wooden plaques around the room. It is a room filled with character and history. The floor creeks under the carpet as I walk, gazing up at the names on the wall. 

Nearly 100 years old, it has wooden lockers around the perimeter, with a large comfortable seating area in the middle. I think about the great players listed on the walls above, walking the same floors.

Another highlight of Seminole is the golf staff, headed by the dean of PGA Professionals in the US.  Bob Ford has trained and had many of his assistants be selected to be head professionals at some of the finest courses in the country. The sincere attitude and level of service provided adds to the enjoyment of a day at Seminole. 

It was a thrill to see and play Seminole. I owe my host a big debt of gratitude for inviting me. I would love to go back again. While we caught two great days with little wind in the morning, typically it blows around 20 mph or stronger. 

“I couldn’t keep my hat on my head the last time I was here,” said my friend. The wind, the firm and lightning fast green complexes make Seminole what it is, a great course that is difficult. 

It was a special trip to see Seminole. I would love to go back again in A Life In Golf. "
